,Title,Label
2942,역대급 버거 이벤트완전 혜자라고 난리난 버거킹 11 이벤트,0
2943,버거킹 만우절 가짜 신메뉴와 세트 업 이벤트 눈길,1
2944,대한항공 셀프 체크인 이용하고 경품도 타세요,0
2945,버거킹 프리미엄 와퍼 3종 할인 행사 진행,0
2946,버거킹 팬톤과 함께한 여름맞이 젤리에이드 3종 출시,1
2947,롯데리아 vs 버거킹의 4번째 승부수는 킹 치킨버거,0
2948,악몽 버거·탄산수 코스튬 핼러윈 마케팅 美 올해 10조 규모 특수,0
2949,버거킹 와퍼 등 12개 메뉴 100원씩 올려햄버거 가격 줄인상,0
2950,버거킹 한국 진출 34주년 기념 와퍼세트 10년 전 가격’ 할인 행사 진행,1
2951,이베스트투자증권 부울경 지역 대학생 주식 모의투자대회’ 개최,0
2952,버거킹 불고기버거 50 대박 할인 이벤트 진행,1
2953,버거킹 만우절 초콜릿와퍼 영상 화제네티즌 진짜 팔면 안돼,0
2954,가짜 고기 이어 가짜 달걀 시대 왔다,0
2955,버거킹마저햄버거 가격 다 올랐다,0
2956,버거킹의 황당한 러시아 월드컵 판촉 행사,0
2957,완전 초코케이크 아니야 버거킹 초콜릿 와퍼” 출시  이벤트 영상,1
2958,연말 달라진 이통사 멤버십 포인트 혜택은,0
2959,작년 커피전문점·패스트푸드점 개인컵 이용 1천만 건,0
2960,커피전문점·패스트푸드점 1회용컵 수거량 72 감소,0
2961,월드컵 러시아 버거킹 선수 아이 임신하면 평생 공짜’ 황당 광고 논란,-1
2962,11월 1일부터 롯데리아 제품·서비스 가격 올라햄버거값 줄줄이 가격인상 또,0
2963,식물성고기 만드는 벤처 美상장 대박,1
2964,신메뉴에 TV CF·이벤트버거킹 공세 강화,1
2965,위메프 88특가 매 시각 특가상품 보니 에어팟2·뿌링클·에스티로더 파데,0
2966,버거킹KFC 등 가격 오른 햄버거배달 최소금액도 잇달아 껑충’,0
2967,MT리포트배달의 민족’은 배달을 할까,0
2968,IPO기자간담회 닭고기 기업 마니커 코스닥 노크,0
2969,네슬레가 내놓는 인공고기 버거고기보다 단백질 더 풍부,0
2970,상반기 화제작 어벤저스 비씨카드로 결제해서 보세요,0
2971,스타벅스부터 하얏트까지···플라스틱 빨대 퇴출하겠다,-1
2972,버거킹 햄버거값도 오른다와퍼 100원 인상,0
2973,버거킹 5월 가정의 달 기념 킹박스KING BOX 3종 재출시,1
2974,Show me the TV’ LG‧삼성 TV부문 디스전’ 본격화,0
2975,중국 유통혁명 현장을 가다QR코드로 테이블 주문에 직원 팁까지 18분內 배달,0
2976,근거리 물류 스타트업 바로고 120억 규모 시리즈 B 유치,1
2977,설왕설래 식물성 고기,0
2978,버거치킨 업계 가을 입맛 사로잡는 신제품 러시 치즈맛 VS 매운맛,1
2979,한솥 UN지원SDGs협회 지속가능 글로벌 브랜드 40’ 선정 인증서 전달식 열,0
2980,한솥 UN지원SDGs협회 지속가능 글로벌 브랜드 40’ 선정 인증서 전달식 열,0
2981,박지윤 21일 인스타그램을 통해 일상 공개,0
2982,1회용컵 줄이기’ 9개월月 수거량 72 줄었다,0
2983,커피전문점·패스트푸드점 일회용컵 수거량 1년새 72 감소,0
2984,슬픈 눈은 이제 그만 SNS 휩쓴 댕댕이용 햄버거,0
2985,코스트코 GMO 가공식품 최대 수입처,0
2986,공정위 세븐일레븐·이마트24 가맹본부 실태 조사 나서,0
2987,버거킹 일주일간 와퍼 세트 10년 전 가격에 판매,0
2988,서브웨이도 대체육류 샌드위치 판매,0
2989,KT 7월 멤버십 혜택 공개워터파크 50 할인,0
2990,서브웨이도 대체육류 샌드위치 판매,0
2991,KT 7월 멤버십 혜택 공개워터파크 50 할인,0
2992,버거킹 등 패스트푸드 자주 먹는 아이 ADHD 위험↑,0
2993,에이픽스게이밍 어디계세요 제품 인증 이벤트 진행,0
2994,대한항공 셀프 체크인 이용 경품 행사,0
2995,메쉬코리아 배달 서비스 버거킹 전직영점 확대,0
2996,소비자가 뽑은 패스트푸드점 칙필레 No1”,0
2997,버거킹 와퍼 세트 10년 전 가격’ 할인 행사,0
2998,버거킹 2일부터 가격 인상,0
2999,버거킹 일부 메뉴 100원씩 인상햄버거 다올랐다,0
3000,햄버거 가격 올리면서 배달수수료도 죄다 인상한 맥날X롯데리아X버거킹,0
3001,대한항공 휴가철 셀프 체크인 경품행사,0
3002,국내 글로벌 식품브랜드 역수출로 웃었다,0
3003,월정액 서비스 선보인 커넥츠 스카이에듀,0
3004,대한민국 대표 프랜차이즈 한솥도시락 2019 굿시즈 컨벤션 행사 도시락 후원,0
3005,버거킹 25일까지 와퍼 3종 3900원에 판매,0
3006,버거킹 오늘29일부터 일주일간 와퍼세트 5700원10년 전 가격,0
3007,넥슨 야생의 땅 듀랑고’ X 버거킹’ 제휴 프로모션 실시,1
3008,배달대행 고속성장 이면에 배달노동자 폭염·폭설 무방비,0
3009,노브랜드 버거 직접 먹어보니1900원에 이런 맛이’,0
3010,배달대행 고속성장 이면에 배달노동자 폭염·폭설 무방비,0
3011,노브랜드 버거 직접 먹어보니1900원에 이런 맛이’,0
3012,버거킹 5월 감사의 달 맞아 다양한 프로모션 진행,0
3013,SSG닷컴 신세계몰 오픈 22주년 쓱가 대축제’최대 80 할인,1
3014,버거킹 2일부터 와퍼 등 12개 메뉴 100원 인상,0
3015,버거킹 사내 신메뉴 공모전 2018 쇼미 유어 아이디어’ 개최,1
3016,바로고 120억 규모 시리즈 B 유치기업가치 1000억원 평가,1
3017,일동제약 아로나민 전 세계 가장 지속가능한 브랜드 우수그룹 선정,0
3018,일회용컵 사용 확 줄었다매장내 수거량 9개월 새 72↓,0
3019,커피전문점·패스트푸드점 1회용컵 수거량 72 감소,0
3020,일회용컵 사용 확 줄었다매장 내 수거량 9개월 새 72↓,0
3021,커피전문점·패스트푸드점 1회용컵 수거량 72 감소,0
3022,햄버거 고객 충성도 1위는 인앤아웃,1
3023,일동제약 아로나민 UN지원SDGs협회 선정 전 세계 가장 지속가능한 브랜드 ,0
3024,나는 약물중독자입니다④ 아이언 맨’은 약물중독자였다,0
3025,SK텔레콤·KT 통신사 8월 할인 통해 도미노피자·CGV 영화예매·버거킹 저렴,0
3026,넥슨 야생의 땅 듀랑고’ 버거킹 제휴 프로모션,1
3027,외식물가 들썩 햄버거 빅3 줄줄이 인상 대열 합류,0
3028,천호엔케어 건강기능식품 아이키쑤욱’ 모델로 SKY캐슬’의 배우 김병철,0
3029,롯데컬처웍스 동영상 플랫폼 씨츄 집캉스’족들 위한 다채로운 이벤트,0
3030,더벨어피너티의 버거킹 日진출롯데 운영권 살얼음,1
3031,버거킹 킹박스KING BOX로 속도 든든 마음도 든든,0
3032,논단질문으로 알아보는 동물복지,0
3033,딜링룸 백브리핑 英 골드만·JP모건은 페북·애플보다 행복하다,0
3034,에듀윌 2019 하반기 공기업대기업 필기시험 후기 작성 이벤트 실시,0
3035,KT 5Good 위크로 캐리비안베이 반값에 즐기세요,0
3036,버거킹 강남 지역서 24시간 딜리버리 서비스 시행,0
3037,게임투데이 넷마블 쿵야 캐치마인드 출시 외,1
3038,에듀윌 하반기 공기업 NCS·대기업 필기시험 후기 이벤트 마련,0
3039,버거킹 킹대킹 TV CF 온에어투표 이벤트 실시,0
3040,버거킹 몬스터와퍼’ X 코카콜라 모바일 앱 코크 플레이’ 콜라보 프로,0
3041,딥페이크는 어떻게 마케팅에 위협이 되나,0
3042,커넥츠 스카이에듀 전 강좌 무제한 수강 월 9천900원,0
3043,내년 최저임금 심의 본격화 프랜차이즈업계 인건비 부담 가중에 예의주시,0
3044,디지털 마케팅 성공하려면 모바일 네이티브에 맡겨라,0
3045,2018 유통 10대 뉴스 최저임금·오너갑질로드숍 부도에 살길 찾기’,-1
3046,기묘한 협업,0
3047,커피전문점·패스트푸드 매장 일회용컵 수거량 72 줄었다,0
3048,커피패스트푸드 브랜드 21곳 1회용 컵 사용 72 줄었다,0
3049,브라질 상파울루서 대규모 동성애자 축제300만명 참가,0
3050,버거킹 국내 단독 신메뉴 몬스터와퍼 2종 10주 한정 출시,1
3051,카드뉴스 20대 체크카드 추천 대학생이 쓰면 개이득인 체크카드 BEST7,0
3052,버거킹도 와퍼 등 12개 메뉴 100원씩 올려,0
3053,마니커에프앤지 코스닥 상장 통해 최고의 육가공 회사 도약,1
3054,유앤비X유니티 햄버거 브랜드 CF모델 발탁매력 大분출’,0
3055,신세계몰 오픈 22주년 기념쓱닷컴 쓱가 대축제에서 구입하면 좋은 할인 상,1
3056,미국인 외식비 지출 꾸준히 증가지난해에도 6나 증가,1
3057,버거킹 와퍼 3종 35 할인 행사 전개3900원 균일가,0
3058,타코벨 버거킹 제치고 미 식당 체인점 4위,0
3059,버거킹 풍성한 고객 혜택 담은 5월 프로모션 진행,0
3060,버거킹 풍성한 고객 혜택 담은 5월 프로모션 진행,0
3061,햄버거 위해 뭉친 유앤비X유니티,0
3062,버거킹 제26회 국민이 선택한 좋은 광고상 수상,1
3063,콰트로치즈가 뭐길래’치즈에 빠졌다,0
3064,커피전문점·패스트푸드점 일회용컵 사용 확 줄었다매장내 수거량 72 ↓,0
3065,커피전문점·패스트푸드점 1회용컵 수거량 72 감소,0
3066,대한항공 셀프 체크인 경품행사 진행,0
3067,마켓인사이트공모주 일반 청약 격돌 마니커에프앤지나노브릭 엇갈린 성적,0
3068,트럼프 연준 흔들기 점입가경,0
3069,주말쇼핑정보 쿠팡·옥션 봄 프로모션부터 KFC·요기요 먹거리 할인까지,0
3070,마켓인사이트공모주 일반 청약 격돌 마니커에프앤지나노브릭 엇갈린 성적,0
3071,트럼프 연준 흔들기 점입가경,0
3072,주말쇼핑정보 쿠팡·옥션 봄 프로모션부터 KFC·요기요 먹거리 할인까지,0
3073,야생의 땅듀랑고 버거킹 제휴 이벤트버거킹 몬스터와퍼’ 쿠폰 지급,1
3074,버거킹 더블킹 시리즈 신제품 더블치킨맨’ 출시,1
3075,바로고 일 배달 콜 수 20만건 돌파역대 최고치,1
3076,10년전 가격 vs 11버거킹·롯데리아 3번째 이벤트 격돌,0
3077,일동제약 아로나민’ 전 세계 가장 지속가능한 브랜드 우수그룹 선정,0
3078,美 패스트푸드점 채식버거 열풍 도입 후 이용량 ↑,1
3079,네이버 자회사 스노우 잼라이브 폭발적 인기로 수익모델 엿봐,1
3080,일동제약 아로나민’ 전 세계 가장 지속가능한 브랜드 우수그룹 선정,0
3081,美 패스트푸드점 채식버거 열풍 도입 후 이용량 ↑,1
3082,네이버 자회사 스노우 잼라이브 폭발적 인기로 수익모델 엿봐,1
3083,내달 상장 마니커FG 식품소비 트렌드 변화 수혜,1
3084,할로윈 즐겨요배스킨라빈스·버거킹 프로모션 진행,0
3085,버거킹 대표 프리미엄 와퍼 3종 할인 행사 진행,0
3086,기후변화를 품다 정치보다 기후변화 심각하다,0
3087,KT 멤버십 5Good위크’로 캐리비안베이 반값에,0
3088,롯데리아 vs 버거킹 프로모션 재격돌당신 선택은,0
3089,잼라이브 X 버거킹 오늘 상금 2천만원 1인 상금 최소 10만원·풍성한 이벤,0
3090,국내도 채식 훈풍비건 식품 도입에 속도내는 식품업계,0
3091,커피전문점·패스트푸드점 매장내 일회용컵 사용량 72 감소,0
3092,매장서 싹 사라진 1회용환경부업계 자발적협약 순항,1
3093,버거킹 대표 메뉴 와퍼’ 11 쿠폰 선착순 증정 행사 실시,0
3094,대한항공 셀프 체크인 이용하고 왕복항공권 받아가세요,0
3095,더벨롯데GRS 만성적자 늪에 빠진 햄버거 1위,1
3096,크리에이티비티를 논한다 2018 칸라이언즈X 서울 내달 10일 개최,0
3097,선수 아이 임신하면 평생 공짜’ 햄버거 광고 시끌,0
3098,BTS·복면가왕·아기상어 애드에이지 美서 가장 인기있는 20개 브랜드 발표,1
3099,SAP S4HANA 및 SAP 아리바로 버거킹의 디지털 변혁 지원,0
3100,버거킹 스테이크 패티로 더욱 강력해진 몬스터X 출시,1
3101,귀여운 할로윈 캐릭터 담긴 식품으로 할로윈 분위기 제대로 만끽하자,0
3102,김상조 우리나라도 버거킹 도미노피자 본받아 상생해야,0
3103,와이즈앱 비교하기156 2019년6월 배달 앱 사용자 동향,0
3104,기업이 사는 법 유통 공룡들 햄버거 맛집’ 집착 이유는,1
3105,콧대 높던 대형 외식업체 줄줄이 배달앱 行,0
3106,전등도 대신 갈아줘요 집주인이 회사인 임대주택은 뭐가 다를까,0
3107,대구 카페 90는 머그잔 전환플라스틱 빨대는 97 여전,0
3108,버거킹 대표 사이드 메뉴 21치즈스틱과 아이스크림 선데 할인행사 진행,0
3109,만우절 펀FUN 마케팅’버거킹 가짜 신메뉴 초콜릿 와퍼’ CF영상 및,1
3110,배달 앱 시장 지각변동 배달의민족 실책 틈타 요기요·배달통 대반격,0
3111,위메프 88특가 이벤트 상품 퀄리티 완전 이득이네 믿을 수 없는 가격 찬스,0
3112,H마트 플러싱 옛 버거킹 자리 신축 7층 주상복합건물에 입점,1
3113,식당 사람 구하기 더 힘들어진다,0
3114,메쉬코리아 부릉’ 버거킹 전 직영점으로 배달 대행 확대,0
3115,KT 7월 멤버십캐리비안베이 반값 할인 등 풍성’,0
3116,커피전문점·패스트푸드점 매장 내에선 1회용 컵 안 써요,0
3117,버거킹 100원씩 가격인상···햄버거세트 1만원 시대,0
3118,글로벌Biz 24 KFC 식물성분 인공육으로 만든 치킨’ 시험제공채식주의,0
3119,햄버거도 1만원 시대 한끼 먹기 참,0
3120,글로벌Biz 24 KFC 식물성분 인공육으로 만든 치킨’ 시험제공채식주의,0
3121,햄버거도 1만원 시대 한끼 먹기 참,0
3122,넥슨 야생의 땅 듀랑고 X 버거킹 제휴 이벤트 실시,1
3123,카카오 내비 운행 기록으로 맛집을 뽑아봤다,1
3124,윤정훈 기자의 해외주식 톡 맥도날드부터 쉐이크쉑까지 글로벌 햄버거 전,0
3125,월드컵 선수 아이 임신하면 평생 공짜 햄버거 광고 논란,-1
3126,버거킹 신제품 몬스터와퍼 출시 한 달 만에 100만 개 판매 기록,1
3127,MT리포트8590원 최저시급 왜따져요800원 건당인생,0
3128,에듀윌 공기업 NCS 및 대기업 필기시험 후기 작성 이벤트,0
3129,5G 초능력으로 멤버십 즐기세요”,0
3130,버거킹 몬스터X 타바스코 소스 무료 증정 이벤트,0
3131,시그널 VIG파트너스 글로벌 한식 시장 베팅···본촌 인터내셔날 인수,0
3132,SSG닷컴 신세계몰 오픈 22주년 쓱가 대축제최대 80 할인,1
3133,해커스공무원 국가직 7급 공무원 시험 직후 합격예측 풀서비스 제공,0
3134,굿모닝 베트남 베트남 패스트푸드 시장 성장 둔화,0
3135,5년간 GMO 가공식품 가장 많이 수입 판매한 코스트코의 충격적 실체,0
3136,시그널 토종 PEF 큐캐피탈 첫 식음료 투자···BBQ에 1200억 쏜다,0
3137,SAP S4HANA 및 SAP 아리바로 버거킹의 디지털 변혁 지원,0
3138,칸 라이언즈 2019 삼성화재 꽃병소화기 동상 크리에이티브 전략 부문,0
3139,SR경제라이프 KT 5Good위크로 캐리비안베이 반값에 즐기세요,0
3140,버거킹 치킨버거 밸런스 치킨버거’ 출시  통가슴살 치킨 패티와 신선한,1
3141,외국인 프로선수에게 세금 더 떼는 이유,0
3142,박지윤 인스타그램 최근 진짜 오늘까지만 먹어야지이러다 몰디브 가서,0
3143,버거킹의 역발상햄버거값 인하,0
3144,르포평택 안의 작은 캘리포니아주한미군 새 둥지 캠프 험프리스,0
3145,버거킹봄 꽃 만발 친구와 연인과 버거킹 와퍼 11 쿠폰드려요,0
3146,버거킹 새 광고 모델에 배우 윤계상 발탁,0
3147,버거킹 25일까지 프리미엄 와퍼 3종 3900원에 판매,0
3148,대한항공 셀프 체크인 이용하고 국제 항공권 경품도 받으세요”,0
3149,KT 5G 초능력으로 달라진 멤버십 즐겨보세요,0
3150,KT 5G 초능력으로 달라진 멤버십 즐겨보세요,0
3151,B2B 닭고기 강자 마니커에프앤지 일반 소비자 매출 비중 50로 높일 것,0
3152,한식 규격표준화 손에 들고 다닐 수 있게 식품개발 서둘러야,0
3153,IT 칼럼먹거리도 코딩하고 클라우드로 보낸다,0
3154,뉴욕증시 IBMPG 등 실적 호조 상승세 반전,0
3155,칸 라이언즈 2019 삼성전자 갤럭시X포트나이트 스킨·파워셰어로 은상·,0
3156,롯데리아 버거킹재팬 누적 손실 1000억 성장한계 봉착,0
3157,임파서블 푸드 자녀있는 밀레니얼 세대 식물성고기 수용력 높아,0
3158,버거킹 몬스터X’ 출시,1
3159,버거킹 한국 진출 34주년 기념10년 전 가격’ 할인 행사 실시,1
3160,버거킹 한국 진출 34주년 기념10년 전 가격’ 할인 행사 실시,1
3161,칸 라이언즈 2019 제일기획 삼성화재 꽃병소화기’로 동상 크리에이티,0
3162,커피전문점·패스트푸드점 1회용컵 수거량 72 줄었다,0
3163,쿠팡 이츠 내달 정식 출시배달 게임체인저 노린다,1
3164,해커스경찰 경찰 교재부터 에어팟까지 전부 100원에 제공하는 감사제 열어,0
3165,KT 워터파크와 배스킨라빈스 할인 등 5Good위크’ 혜택 확대,0
3166,성수기 셀프체크인으로 간편하게” 대한항공 경품 이벤트,0
3167,경기도 강소기업 세계를 향한다·1아이엠티소프트하드웨어·솔루션 동시,0
3168,바로고 일 배달 콜 수 20만 건 돌파역대 최고,1
3169,알아두면 쓸모있는 시니어 할인혜택’,0
3170,바로고 일 배달 콜 수 20만건 돌파,1
3171,오늘의 유통 단신 버거킹 더블치킨맨 출시 外,1
3172,가성·가심비 甲식품·외식업계 연말 파티 푸드시장 꽉 잡겠다,0
3173,키오스크 무인결제기 전문업체 다인아이앤씨 자매떡볶이 서울 1호점 설치,0
3174,칸 라이언즈 2019 칸이 선택한 크리에이티비티는 사회적 소수자와의 동등성,0
3175,버거킹 국내 단독 신메뉴 몬스터와퍼’ 2종 출시,1
3176,버거킹 킹대킹 선정 이벤트,0
3177,KT 5G 초능력으로 달라진 멤버십 즐겨보세요,0
3178,위메프 88특가 매시 정각 이어지는 타임특가 상품은,0
3179,한솥 UN지원 SDGs협회 발표 글로벌 지속가능한 브랜드 40’에 선정,0
3180,위메프 88특가 매시 정각 이어지는 타임특가 상품은,0
3181,한솥 UN지원 SDGs협회 발표 글로벌 지속가능한 브랜드 40’에 선정,0
3182,대한항공 셀프 체크인 이용자 대상 경품 행사,0
3183,협력이익공유제 실험 나선 유통업계②20년된 미 던킨도너츠 모델 성공 가능,0
3184,넥슨 듀랑고버거킹’ 제휴 프로모션 실시,1
3185,100원 인상된 버거킹 와퍼 기자가 직접 먹어봤습니다,0
3186,버거킹 킹대킹’ TV CF 온에어 및 투표 이벤트 실시,0
3187,버거킹 새로운 광고 모델로 윤계상 발탁,1
3188,혼자 편안히 둘러보세요 언택트 마케팅 인기,1
3189,오태훈의 시사본부 햄버거 배달원 내가 콜라보다 못한 존재”,0
3190,버거킹 내달 4일까지 와퍼세트 10년 전 가격에 판매,0
3191,악마의 불맛버거킹 국내 단독 신메뉴 몬스터와퍼’ 출시,1
3192,11일엔 11번가서 득템최대 할인 행사,0
3193,2018 식품결산 식품업계 전방위로 확산된 가격 인상,0
3194,월드컵 선수 아이 임신하면 평생 공짜 햄버거 광고 논란,-1
3195,전 강좌 무제한 수강 월 9900원” 커넥츠 스카이에듀 월정액 서비스 9달,0
3196,환경부 일회용품 줄이기 협약 이행결과 발표,0
3197,ZZIM 버거킹 신메뉴 몬스터X,1
3198,버거킹 와퍼 등 가격 인상,0
3199,에듀윌 하반기 공기업 NCS 및 대기업 필기시험 후기 이벤트 실시,0
3200,바로고 하루 배달대행 20만건 기록역대 최고,1
3201,실리콘밸리 리포트 실리콘밸리에 푸드테크 열풍자금·인재 몰려든다,1
3202,버거킹 더블오리지널치즈버거 무료 세트업 행사 진행,0
3203,KT멤버십 캐리비안베이 반값 할인,0
3204,버거킹 카톡 플러스 친구 대상 프로모션 진행,0
3205,KT 5월 멤버십 혜택 강화5G 상용화 맞춰 VVIP 등급 신설,0
3206,버거킹 햄버거에서 손톱 모양 이물질본사 책임회피 급급,-1
3207,버거킹 10년 전 가격 할인 행사 실시,0
3208,넥슨 야생의 땅 듀랑고×버거킹 제휴 프로모션 실시,1
3209,커넥츠 스카이에듀 월 정액 서비스 9달라패스 출시,1
3210,버거킹 와퍼·불고기와퍼 세트 10년 전 가격에 판매,0
3211,독퍼네티즌의 힘 국내서도 이벤트,0
3212,식음료업계 할로윈데이 겨냥 프로모션 잇따라,0
3213,버거킹 2일부터 와퍼·불고기와퍼 등 일부 메뉴 100원 인상,0
3214,칸 라이언즈 2019 삼성전자 갤럭시X포트나이트 스킨·파워셰어로 은상·,0
3215,유앤비X유니티 나란히 광고모델 발탁 열일 행보,0
3216,대한항공 셀프 체크인 이용 승객 대상 경품 행사 1등 국제선 왕복 항공권,0
3217,정치인에겐 밀크셰이크”英 저항의 상징,-1
3218,식음료업계 할로윈 분위기 살리는 파티푸드 제안,0
3219,매 시각 새 상품 특가 무료배송까지위메프88특가 어떤 물건 있나,0
3220,위메프88특가 88원이 무료배송 상품과 기간은,0
3221,더벨군인공제회 영국 2위 휴게소 운영사에 400억 투자,0
3222,이베스트證 부울경 지역 대학생 대상 주식 모의투자대회,0
3223,버거킹 빅더블버거·더블오리지널치즈버거’ 출시,1
3224,커넥츠 스카이에듀 월 정액 서비스 9달라패스 출시,1
3225,매장 내 수거량 72나 줄었는데 일회용 컵 전체 사용량은 제자리 왜,0
3226,버거킹 킹대킹 승자 더블오리지널치즈버거’ 무료 세트업 행사 실시,0
3227,홍콩계 사모펀드 LG 서브원 지분 60 6020억원에 인수,0
3228,KT 5Good위크’로 캐리비안베이 반값에7월 멤버십 혜택 제공,0
3229,바로고 일 배달 콜 수 20만건 돌파 역대 최고,1
3230,바로고 일 배달 콜 수 20만건 돌파 역대 최고,1
3231,월드컵 선수와 임신시 평생 무료” 햄버거 업체 광고 파문,-1
3232,임신하면 햄버거 평생 공짜황당한 월드컵 마케팅,0
3233,버거킹 내일부터 와퍼 등 12개 메뉴 100원씩 인상,0
3234,햄버거 아이 먹니” 배우 윤계상 버거킹 광고 모델 발탁,0
3235,세습 아닌 전유가 문제,-1
3236,EE칼럼 구독경제가 뜬다,0
3237,24시간 배달 매장 늘린 버거킹배달 최소금액도 늘어,0
3238,11번가 5월 십일절 매시간 타임딜 최대 78 할인,0
3239,버거킹도 햄버거 가격 인상 12개 메뉴 100원씩↑,0
3240,커피전문점패스트푸드점 1회용 컵 수거량 72 감소,0
3241,유앤비X유니티 버거 광고모델 발탁출구없는 신선한 매력 大분출,0
3242,오늘24일 요기요서 1955버거치즈스틱콜라치킨랩 단돈 5천원,0
3243,버거킹 12개 메뉴 가격 100원씩 올려햄버거 가격 줄인상’,0
3244,비디오머그 밀크셰이크가 저항의 상징영국에서 확산 중인 밀크셰이킹m,-1
3245,식물성 고기 인기에 콩 없어서 못 산다,1
3246,심야에 불 끄는 편의점 하늘의 별 따기 된 알바,0
3247,어벤져스 엔드게임 VOD BC카드로 어셈블,0
3248,르포 최저임금 후폭풍’ 지금 프랜차이즈는···,0
3249,프랜차이즈 점포무인화 부업 창업 확산,0
3250,식품·식당이 가격인상을 두려워하지 않는 까닭,0
3251,버거킹 넥슨 모바일 게임 야생의 땅 듀랑고’ 아이템 쏜다,0
3252,해커스경찰 100원 감사제 경찰 교재부터 에어팟까지 전부 100원에 받을 기,0
3253,버거킹 빅더블버거·더블오리지널치즈버거’ 신제품 출시,1
3254,시간을 거슬러버거킹 10년전 가격 시즌2 선봬,0
3255,NW리포트사모펀드의 세계①10년 만에 3배’665조로 불어난 PEF 시장,0
3256,버거킹 몬스터와퍼 출시 한 달만에 판매량 100만개 돌파,1
3257,할로윈데이 맞이 외식·식음료 업계 이벤트 인기,1
3258,김석운의 베트남 통신176 식품의 현지화,0
3259,진화하는 패스트푸드점,1
3260,진화하는 패스트푸드점,1
3261,가짜 고기’가 식량 혁명 이뤄낼까 국내 최초 대체육’ 버거 먹어보니,0
3262,11번가 5월 십일절 매시간 타임딜’최대 78 할인,0
3263,일회용컵 그냥 쓸게요 손님의 불만이 애먼 사장님을 짓눌렀다,-1
3264,이번 할로윈은 나홀로 홈파티 분위기 높이는 먹거리 22,0
3265,KT 멤버십 6월 도미노피자·스타벅스·투썸플레이스 혜택,0
3266,버거킹 아메리칸 수제버거 신메뉴 2종 출시,1
3267,버거킹 너마저햄버거값 줄줄이 가격 인상,0
3268,버거킹 시즌 한정 킹박스 출시,1
3269,여기어때 英 사모펀드 CVC 매각 인수 규모 3000억 평가,-1
3270,버거킹 시즌 한정 킹박스 출시,1
3271,여기어때 英 사모펀드 CVC 매각 인수 규모 3000억 평가,-1
3272,게임 단신 넥슨 야생의 땅 듀랑고 버거킹과 제휴 프로모션 外,1
3273,Invest자금 넘치고 대기업은 위축PEF 간 손바뀜 거래 늘 듯,0
3274,해커스공무원 국가직 7급 공무원시험 합격예측 풀서비스 오픈,1
3275,유앤비X유니티 햄버거 모델 발탁더유닛 최종 우승팀 특혜,0
