,Title,Label
4558,빅뱅 승리 초록우산 어린이재단에 아오리라멘 수익금 1억원 기부,1
4559,가맹·대리점만 애꿎은 피해오너리스크 보상은 요원,-1
4560,빅뱅 승리 초록우산 어린이재단에 아오리라멘 수익금 1억원 기부,1
4561,가맹·대리점만 애꿎은 피해오너리스크 보상은 요원,-1
4562,정준영·최종훈·승리 동업 밀땅포차 현재는 폐업,-1
4563,승리 라멘집 1만원 라멘 맛 평가 어땠나 보니,0
4564,승리 라멘 가게로 화제 아오리라멘 여전히 유리홀딩스 홈페이지에 이름 있,0
4565,승리 버닝썬 이어 라멘사업 사내이사도 사임,0
4566,이슈종합 승리 라멘집 유명세 탄 아오리라멘 일부 가맹점주 선긋기 승리,0
4567,이화연의 요리조리 승리 리스크’가 보여준 가맹사업법 빈틈,-1
4568,오너리스크에 또 흔들리는 식품업계 미스터피자 상폐 카운트다운,-1
4569,승리 라멘집’ 인식 선긋기 나선 가맹점주들 승리와 무관합니다”,0
4570,이슈종합 승리 라멘집 유명세 탄 아오리라멘 일부 가맹점주 선긋기 승리,0
4571,이화연의 요리조리 승리 리스크’가 보여준 가맹사업법 빈틈,-1
4572,정준영·승리 밀땅포차이미 폐업 후 현재는 고깃집,-1
4573,오너리스크에 또 흔들리는 식품업계 미스터피자 상폐 카운트다운,-1
4574,승리 라멘집 가맹점주 승리와 관계 없다아오리라멘 승리 가족 및 지인 관,0
4575,승리 라멘집’ 인식 선긋기 나선 가맹점주들 승리와 무관합니다”,0
4576,성추행·마약·폭행 오너리스크 몸살방지법은 무용지물,-1
4577,빅뱅 승리 버닝썬 이어 라멘사업 이사직도 사임,0
4578,승리 라멘사업도 정리버닝썬 마약 권유 추가폭로종합,0
4579,이슈 유리홀딩스의 유 후아유,0
4580,이슈 유리홀딩스의 유 후아유,0
4581,현장에서오너리스크 방지법으로 일자리 늘리는 법,-1
4582,기자수첩 버닝썬 나비의 날갯짓 어디까지 미치려나,0
4583,승리 버닝썬 이어 라멘 사업 사내이사직도 사임,0
4584,현장 성관계 몰카’ 정준영 모든 혐의 인정” 울컥,-1
4585,후쿠시마 원전 근처에서 육수 공급 소문 승리 라멘집 엎친데 덮친격 가맹,0
4586,빅뱅 승리 성접대 카톡 가수 C씨’ 정체는 아오리라멘 사장’박한별 남,0
4587,버닝썬 VIP 직원이 마약 권유 폭로 → 승리 라멘 사내이사 사임 엑s 이슈,0
4588,승리 라멘집으로 유명세 탄 음식점 승리 사태로 줄어드는 판매량에 승리,0
4589,더셀럽포토영장실질심사 출석한 아오리 라멘 점주 김 모 씨,0
4590,버닝썬 VIP 마약 복용 권유받았다 증언,0
4591,빅뱅 승리 초록우산 어린이재단에 아오리라멘 수익금 1억원 기부,1
4592,로이킴 몰카 논란에 장수막걸리 불매운동 확산,-1
4593,YG·방송사·황금 인맥 승리·정준영 흔적 지우고 선 긋고,0
4594,단독 승리 아빠 내 아들은 클럽 대표 아니다조만간 입장 발표”,0
4595,아오리라멘 계산대에서 당당했던 승리의 모습아오리라멘 불매운동에 와글,-1
4596,공공돋보기 또 불거진 가맹점 오너 리스크,-1
4597,이슈진단 불매운동에 손님 뚝’승리라멘 가맹점주 한숨만,-1
4598,아오리라멘 불매운동 벌어지나피해는 가맹점에 고스란히,-1
4599,승리 라멘집 처음에 엄마가 사업한다고 반대 빅뱅만 잘해라,0
4600,승리 라멘집 매출 75 급감母 홍대명동 지점 가맹점주 총회도 참석했다,-1
4601,FT아일랜드 최종훈 경찰에 음주운전 공개 말아달라 파문,-1
4602,정준영·승리·최종훈 운영했다는 밀땅포차 현재 폐업한 것으로 알려져,-1
4603,혼밥탐방 빅뱅 승리의 아오리 라멘 인기 식당이지만 혼밥하기 어색함 없,1
4604,영상뉴스 승리 라멘집 점주 잘못 없어도 방문 꺼려져”,0
4605,오너일가 마약 개인일탈 왜 우리가 피해보냐성추행·폭행 등 오너리스크,-1
4606,버닝썬 게이트 열리자 승리 가족이 한 일은 일방적 모함 주장 변했나,-1
4607,오너리스크’ 피해 가맹점주 손해배상 받을까 올해 계약 맺거나 갱신한 ,-1
4608,생일 날 연탄 봉사하고 1억 원 기부한 승리,1
4609,승리 라멘집 잡음,0
4610,단독 정준영X승리X최종훈 밀땅포차 현재 폐업 상태,-1
4611,승리 라멘집 잡음,0
4612,매출 75 감소 승리 라멘집 가족 상생 언급 母 홍대명동 지점 가맹점주다,0
4613,최종훈 아오리라멘 국내 33호점 오픈한 가맹점주 승리의 가장 오래된 친구,1
4614,마약·폭행·성희롱·배임 각양각색 오너리스크에 우리만 죽는다,-1
4615,경영진 비행 따른 손해배상 가능할까승리 라멘집 가맹점주 울상,-1
4616,승리·유인석 배후지목 류재욱 그들은 고객윤총경도 모른다는데,0
4617,공식입장광역수사대 측 승리 소환계획無 성접대 의혹 내사中차후 논의,0
4618,장수막걸리 불매운동 확산에 로이킴 개인 회사 아냐,-1
4619,hot_issue 키워드로 본 승리게이트’ 전모  특권층의 민낯,-1
4620,곳곳에서 터져 나오는 탄식들 승리 라멘집 가맹점주 답답 대체 어떤 일이,0
4621,승리 아오리라멘 육수공장 위치 논란 후쿠시마 원전 안전지대 아니다,-1
4622,빅뱅 승리 클럽 버닝썬 이어 라멘사업 사내이사직도 사임,0
4623,군입대로 사내이사 못한다던 승리 아오리라멘 사내이사는 유지중,0
4624,승리 절친 최종훈 지난해 아오리라멘 국내 33호점 가맹점주됐다 그의 가장,0
4625,승리X정준영 동업한 밀땅포차 이미 폐업 상태,-1
4626,★해시태그 승리 아오리라멘 수익금 1억 기부 임직원·스태프 감사,1
4627,버닝썬 사태 이후 아오리라멘 가맹점 카드매출 최대 73 하락,-1
4628,승리 라멘집 발끈,0
4629,issue 위대한 승츠비’ 승리의 성공 신화는 왜 흔들리나,0
4630,승리 라멘집 발끈,0
4631,issue 위대한 승츠비’ 승리의 성공 신화는 왜 흔들리나,0
4632,도의적 보상 받은 승리 라면’ 점주들 법적 보상은,0
4633,승리 라멘집 가맹점주 손님 발길 뚝 아오리라멘,0
4634,Invest승리의 PEF 아이돌 등극 실패뒤늦게 부각된 사모펀드 인맥,0
4635,버닝썬 사건 터진 뒤 다시 보니 성지글이었던 예언 5가지,0
4636,승리 라멘집 불매 점주들 어쩌나 그분 때문에 다 말아먹게 생겨” 과거 월,-1
4637,승리게이트 불똥 장수막걸리·남양유업불매운동까지 홍역,-1
4638,밀땅포차 멤버는 누구 청담동 가게 현재 폐업,-1
4639,아오리라멘 빅뱅 승리유리홀딩스와 관계 끊었다피해방지할 것,-1
4640,함께 이자카야 오픈” 승리와 동업 중인 한국 가수 2인,1
4641,김보영의 키워드 회장 퇴진·손해배상대기업·프랜차이즈 총수 칼바람,0
4642,로이킴 리스크 장수막걸리 발빠른 선긋기에도 불매운동 확산,-1
4643,승리 라멘집 불매운동시상식까지 참석했던 모습보니 불과 2달 전,-1
4644,승리 라멘집 가맹점주 대분노 속사정버닝썬 사태로 초토화 울고 싶어,-1
4645,승리 클럽 버닝썬 폭행 논란버닝썬 VIP 폭로 직원이 마약 권유했다 승리,-1
4646,승리 라멘 가맹점주들 오너 리스크 손해배상 왜 못 받나,-1
4647,승리 초록우산 어린이재단에 아오리라멘 수익금 1억원 기부,1
4648,fn스트리트 버닝썬 게이트,-1
4649,피해 입증 모두 가맹점주 몫 유명무실 오너리스크법’ 뉴스,-1
4650,버닝썬 실소유주라는 몽키뮤지엄 사단 H씨는 누구 승리 업체 몽키뮤지엄,0
4651,승리 라멘집’ 매장당 월매출 2억 최종훈도 운영해 승리 사건 이후 승리 라,0
4652,미운우리새끼 승리 라멘집 비화는母 빅뱅만 잘해라,0
4653,빅뱅 승리 초록우산어린이재단에 1억원 기부,1
4654,아오리라멘 점주는 무슨 잘못 승리 카톡 논란에 깊어지는 한숨,-1
4655,디스패치 밀땅포차 카톡방 승리정준영최종훈 불법 동영상 공유,0
4656,승리 꼼수논란 슬금슬금 발 빼기 대중 신뢰 바닥,-1
4657,최종훈 승리·정준영과 얼마나 친한가 도쿄 번개·라멘 점주vs절친 방,0
4658,아오리라멘 최종훈 33호점 점주 변신,0
4659,단독 승리 어머니 운영 와플 카페 앤드히어 폐업 내막,-1
4660,김영주 의원 연예인 명성에 의존하는 가맹사업의 오너리스크 매우 높아 대,-1
4661,나 혼자 산다 승리 라멘집 CEO의 일상 공개 베트남 호치민까지 접수,0
4662,빅뱅 승리 초록우산 어린이재단에 아오리라멘 수익금 1억원 기부,1
4663,FT아일랜드 최종훈 소속사 FNC엔터테인먼트 이틀째 연락 두절무슨 일,0
4664,승리 라멘집 수익 중 1억원 기부 아이들 승리하도록”SNS★컷,1
4665,이를 어째 승리 라멘집 가맹점주 답답하네 곳곳에서 터져 나오는 탄식,0
4666,버닝썬 논란’ 승리 프랜차이즈 외식업체 사내이사직도 사임,-1
4667,승리에 울고 웃고 프랜차이즈의 스타 리스크’,-1
4668,천지일보 이슈종합 김은경 전 장관 구속영장 기각·환경부 블랙리스트 의혹,0
4669,오너리스크 폭망한 식품업계 막전막후,-1
4670,오너리스크 폭망한 식품업계 막전막후,-1
4671,장수막걸리 확실히 선 그었는데 냉랭하게 라면집 등 줄줄이,0
4672,빅뱅 승리 알고보면 선행천사 2년 연속 1억원 기부,1
4673,승리 라멘 아오리라멘’ 즐거운과 모바일 쿠폰 선물하기 판매 개시,0
4674,승리 라면’ 측 유리홀딩스와 관계 정리하겠다더니···신임 대표 논란,-1
4675,버닝썬에서 놀고 베트남에서 사업하자”몰락한 승츠비 비즈니스 스토리,0
4676,승리 라멘집 가맹점주 울상오너 리스크 손해배상받을 수 있을까,-1
4677,발걸음 뚝 끊긴 승리 라멘집 매장 운영 초토화 되나울고 싶어라,-1
4678,승리 라멘집 수익금 일부 기부임직원분들 감사,1
4679,사면초가 대성성매매 알선죄 적용 가능성은,0
4680,승리 라멘집 수익금 일부 기부임직원분들 감사,1
4681,승리 초록우산 어린이재단에 1억 기부연탄 기부도 3년째 공식,1
4682,사면초가 대성성매매 알선죄 적용 가능성은,0
4683,해외까지 강타한 승리 게이트원정 성접대·물뽕 성폭행 구설에 오른 각국,-1
4684,사장님이라 불러다오사업가로 대박난 국내 연예인 5인,1
4685,안병익의 식신 맛집 겨울을 녹이는 진한 국물의 로맨스 라멘 맛집,1
4686,식음료외식업계 오너 리스크’로 다시 몸살,-1
4687,YG·방송사·황금 인맥 승리·정준영 흔적 지우고 선 긋고,0
4688,빅뱅 승리 유리홀딩스 대표도 사임여전히 매니저가 감사 꼼수 논란,-1
4689,아오리라멘 불매운동까지매장 45개·각 월매출 2억원,-1
4690,빅뱅 승리 초록우산어린이재단에 1억원 기부,1
4691,연예인 인기 따라 등락스타 리스크에 우는 프랜차이즈,1
4692,아오리라멘 불매운동까지매장 45개·각 월매출 2억원,-1
4693,현장ㅣ 승리 버닝썬 논란 후 첫 콘서트 사과했지만의혹해결 無종합,-1
4694,오늘의 뉴스톱5 정준영 1박2일 하차 JYP 트와이스 멤버 루머법적대,0
4695,유인석 유리홀딩스 대표 박한별도 속였다 금융업계vs투자회사,0
4696,버닝썬 사건 해명해” 비난 쏟아지는 승리 인스타그램,0
4697,버닝썬 게이트 확전 속 성접대 의혹 번진 유리홀딩스’ 실체 추적,-1
4698,오너 리스크 손해배상 가능할까속앓이 중인 승리 라멘집 가맹점주,-1
4699,남다른 우정 돋보이는 남자 연예인 4인방승리최종훈정준영로이킴,0
4700,버닝썬 사건 해명해” 비난 쏟아지는 승리 인스타그램,0
4701,버닝썬 게이트 확전 속 성접대 의혹 번진 유리홀딩스’ 실체 추적,-1
4702,빅뱅 승리 2년연속 초록우산 어린이재단에 1억원 기부 공식입장,1
4703,오너 리스크 손해배상 가능할까속앓이 중인 승리 라멘집 가맹점주,-1
4704,남다른 우정 돋보이는 남자 연예인 4인방승리최종훈정준영로이킴,0
4705,최민환 과거 아오리라멘서 맛있는 한끼 냠냠다이어트는 내일부터,0
4706,SK·현대·남양유업만 문제일까오너 一家 관리 특단 필요,-1
4707,승리 라멘집 어쩌나 경제적 피해 속출,-1
4708,승리 여동생 관심폭발에 근황도 공개 라멘집44호점 베트남호치민 오픈,1
4709,스마슈머의 역습 한국은 단 한번도 성공한 적이 없다비웃는 日 누른 韓,0
4710,승리 여동생 관심폭발에 근황도 공개 라멘집44호점 베트남호치민 오픈,1
4711,스마슈머의 역습 한국은 단 한번도 성공한 적이 없다비웃는 日 누른 韓,0
4712,일방적 모함 주장했던 승리 가족 버닝썬 게이트 열리자 한 일은,-1
4713,생일을 더욱 뜻깊게 빅뱅 승리 초록우산어린이재단에 1억 기부,1
4714,살림남2 김승현 딸과 승리 아오리라멘 청담점서 롱패딩 데이트 인증샷,0
4715,승리 근황 홍콩 가수 용조아와 인증샷 환한 미소,1
4716,승리 훈훈 비주얼 뽐내며 찰칵아오리라멘 47호점이 오픈했습니다,1
4717,스마슈머의 역습물건 하나 살 때도 온라인과 비교쇼루밍족에 진화하는 ,1
4718,라멘만 연매출 1천억원 정도 라멘집 50호점 오픈 알린 영앤리치 승리,1
4719,승리 클럽 버닝썬 폭행논란 승리 뭐하나 봤더니상받네,-1
4720,승리 지난해 이어 생일에 1억 기부 연탄 봉사도 3년째,1
4721,라멘만 연매출 1천억원 정도 라멘집 50호점 오픈 알린 영앤리치 승리,1
4722,승리 클럽 버닝썬 폭행논란 승리 뭐하나 봤더니상받네,-1
4723,이시각 연예스포츠 핫뉴스 승리 은퇴 선언·디스패치 정준영 몰카 논란·FT,-1
4724,카드뉴스 조양호 일가 갑질 남양유업 황하나 등 오너리스크로 구설수에,-1
4725,아오리라멘 가맹점주 승리 연예인 절친 종훈이네 다정한 사진 저와 가장 오,0
4726,승리 대중 신뢰 뚝꼼수 논란까지슬금슬금 발 빼나,-1
4727,아오리라멘 홍대 등 다양한 먹거리의 홍대 맛집베스트10 소개,1
4728,빅뱅 승리 VR기업 사장 타이틀 하나 더295억원 투자 유치 성공,1
4729,버닝썬 승리 은퇴 선언 후 남은 숙제 3가지,0
4730,빅뱅 승리 VR기업 사장 타이틀 하나 더295억원 투자 유치 성공,1
4731,버닝썬 승리 은퇴 선언 후 남은 숙제 3가지,0
4732,FT아일랜드 최종훈 알고보니 승리 라멘집 가맹점주돈독한 친분 눈길,0
4733,버닝썬 게이트 9개월 핵심 4인방 근황 추적,-1
4734,승리 성매매알선 등 7개 혐의 검찰 송치12억 횡령 혐의도,-1
4735,빅뱅 승리 생일 맞아 초록우산 어린이재단에 1억 기부,1
4736,버닝썬 폭행 사건’ 논란될 때 승리가 간 곳은,-1
4737,FT아일랜드 최종훈 과거 승리 라멘집에서 한컷 가맹점주 되신 최종훈님과 함,0
4738,승리 생일 맞아 연탄케이크에 촛불 분 승츠비 3년차 봉사”SNS★컷,1
4739,EBN 오늘14일 이슈 종합 서울 공동주택 공시가 1417 상승 고개 숙인 승,0
4740,승리 라멘집 점주 B씨 답답한 심경 보호받을 수 있는 게 없더라,0
4741,빅뱅 승리는 수완 좋은 청년사업가인가 사기꾼인가,0
4742,사장님 타이틀 고사한 승리 크리에이티브 디렉터로 VR사업 참여,0
4743,빅뱅 승리 올 들어 2번째 열애설이번엔 인형미모 유혜원,0
4744,채이배 시장 압력으로 문제 오너 복귀 막아야,-1
4745,승리 매출감소 책임 소송오너리스크 피해 인정될까,-1
4746,빅뱅 승리 아오리라멘 벤처 인증받아 뿌듯하지만 겁나기도”,0
4747,中 매체 이번엔 승리·유혜원 암스테르담 포옹사진 공개,0
4748,스마슈머의 역습제품 생산부터 단종까지 좌우진화하는 프로슈머,1
4749,탤런트 김승현 딸 김수빈과 다정한 데이트부인과 이혼 이유는,0
4750,유혜원·빅뱅 승리 열애설 이틀째 확산소속사 사실 확인 중,0
4751,오늘Who 빅뱅의 승리 위대한 승츠비 향해 가상현실사업 도전,0
4752,경찰 가수 승리를 성매매알선’ 포함 7개 혐의로 검찰에 송치,-1
4753,빅뱅 승리 오늘12일 생일 맞아 초록우산 어린이재단에 1억 기부 공식,1
4754,승리 라멘집 설리 인증 아오리 라멘 맛있다 제일 매운 맛,0
4755,글로벌 브랜드 노린다” 빅뱅 승리 이번엔 VR 사업 크리에이티브 디렉터,0
4756,★해시태그 설리 승리 아오리 라멘 인증샷 맛있어,0
4757,불법영업 논란 대성 수사 본격화승리는 여전히 답보SS초점,-1
4758,빅뱅 막내’ 승리의 몰락성매매알선 횡령 등 7개 혐의 검찰 송치,-1
4759,승리 버닝썬→라멘 사업 이사직 사임 군복무 위한 정리일 뿐,0
4760,승리 성매매알선 등 7개 혐의 검찰 송치12억 횡령 혐의도종합,-1
4761,미우새 승리 라멘집 아오리라멘 매출 공개매장당 2억 원 총 매장 45개,0
4762,뉴스 속 직업 지드래곤·탑 마약 파문 이번엔 승리 성접대 의혹 이중적,-1
4763,뉴스현장 호날두 노쇼 주최사 상대 손해배상 소송 첫 접수,-1
4764,설리 월매출 2억 승리 라멘집 방문 인증 아오리 라멘♥마이,0
4765,나혼자 산다 승리 여동생 인스타 근황 오빠랑 붕어빵승리 여동생 직업·,0
4766,버닝썬 게이트 또 다른 연결고리 몽키뮤지엄 버닝썬 설립 후 문 닫은 내막,-1
4767,승리 라멘집 매출 1080억 FT아일랜드 최종훈도 가맹점 사장님,0
4768,클럽 버닝썬 폭행 승리는 어디에 라멘 브랜드 대표로 시상식 참석,0
4769,단독Y터뷰①빅뱅 승리 사업가요 아티스트가 본업입니다,0
4770,승리가 차린 아오리라멘 가맹점주 된 FT아일랜드 최종훈,0
4771,뉴스공장 신유진 변호사는 누구 법무법인 화담 파트너·거리의 만찬 등 ,0
4772,설리의 아오리라멘 시식평 맛있어 제일 매운 거 먹었더니 입술 아퍼,0
4773,김유림의 연예담 연예인 사장님 ★들은 사업ing,0
4774,이슈종합 버닝썬 승리 모자이크 굴욕에도 경찰 출석시 풀메YG 흔적 지,0
4775,승리 41호 라멘집 오픈 인증위대한 승츠비,1
4776,정준영 최종훈 포함 절친 3인방은 누구 실컷 즐겨요,0
4777,FT아일랜드 최종훈 빅뱅 승리 라멘집 가맹점주됐다,0
4778,빅뱅BigBang 승리 인스타그램 속 자신의 라멘집 앞에서 한컷 44호점 베트,0
4779,빅뱅 승리 초록우산 어린이재단에 1억원 생일맞이 기부연탄 기부도 3년째,1
4780,FT아일랜드 최종훈 빅뱅 승리 라멘집 가맹점주됐다,0
4781,설리 매운 라멘도 맛있게 후루룩,0
4782,빅뱅BigBang 승리 인스타그램 속 자신의 라멘집 앞에서 한컷 44호점 베트,0
4783,빅뱅 승리 초록우산 어린이재단에 1억원 생일맞이 기부연탄 기부도 3년째,1
4784,월매출 2억 승리 라멘집 연일 화제승츠비 41호점 오픈 인증,1
4785,고준희 승리 정준영까지 뜨거운 이유,0
4786,승리 라멘집 가맹점주 된 FT아일랜드 최종훈 잠실새내 오픈,1
4787,국대 떡볶이 김상현 대표 논란 예비 창업인들에 교훈 고민거리 추가,-1
4788,종합 승리 성매매·성매매알선·횡령 등 7개 혐의 버닝썬 검찰 송치만,-1
4789,승리 라멘집 가맹점주 된 FT아일랜드 최종훈 잠실에서 만나요”,0
4790,승리 라멘집 가맹점주 된 FT아일랜드 최종훈 잠실에서 만나요”,0
4791,서울맛집 화제의 승리 라멘집 어떻길래 위치 및 가격 정보,1
4792,★SHOT 한보름 승리 라멘집 방문 후기 얼마나 맛있는지 먹으러 가,0
4793,승리 라멘집 방문한 설리 매운거 먹어서 입술 아포 애교,0
4794,승리 라멘집 37호점 경성대 오픈 인증 두 팔 활짝 벌린 승츠비,1
4795,빅뱅BIGBANG 승리 라멘집 말레이시아 진출한 근황승츠비 맞네,1
4796,국대 떡볶이 김상현 대표 막말에 청년 창업인들만 벌벌,0
4797,접대 여성 미리 보려고승리와 성매매 인정한 유인석은 누구,0
4798,설리 근황 공개 승리 라멘집에서 찰칵 매운거 먹었더니 입술 아파환한 미,0
4799,빅뱅 승리 아오리FB 벤처 인증뿌듯하지만 겁나기도,0
4800,성추행·마약오너리스크 프랜차이즈 가맹점 엑소더스,-1
4801,빅뱅 승리 아오리FB 벤처 인증뿌듯하지만 겁나기도,0
4802,티아라TARA 리더 큐리 승리 라멘집 인증샷 공개호로록짭짭 아오리라멘,0
4803,취재파일 ① 승리는 왜 홍콩에 회사를 차렸나,0
4804,제주신화월드YG 맥주 축제 Y夜G와야지 비어 페스티벌 개최,0
4805,최종훈 200→500→1000만원 제시음주운전 봐달라,0
4806,미운우리새끼 승리 아오리라멘 33호점 원주 오픈 인증 두 팔 벌린 승츠비,1
4807,최종훈 뇌물공여 시도 정준영 변호사 증거인멸 입건 이슈,0
4808,빅뱅 승리를 선배님에서 대표님으로 모시게 된 남자 아이돌,0
4809,승리 아오리라멘이 벤처인증을 받았어요뿌듯해요,0
4810,설리 승리 라멘가게 방문 제일 매운 맛 입술 아퍼”,0
4811,김승현 딸 수빈과 승리네 라멘 가게 방문샷,0
4812,빅뱅 승리 FT 아일랜드 최종훈과 한솥밥,0
4813,빅뱅 승리 아오리 라멘’ 이어 강남에 클럽 오픈,1
4814,이슈진단 베테랑 영화가 아니었다재벌 3세들 왜 마약’에 빠지나,0
4815,PEOPLE 아이돌서 사업가로빅뱅 멤버 승리  외식업·엔터 이어 벤처투자까,0
4816,제주신화월드 XYG맥주 축제 Y夜G와야지 비어페스티벌,0
4817,이시각 연예스포츠 핫뉴스 이동욱 수지 결별·승리 라멘집·기안84 찜질방·,0
4818,승리정준영 등 동업 알려진 밀땅포차 눈길 현재 폐업 중,-1
4819,UHD포토 팬에게 아오리라멘 상품권 증정하는 빅뱅BigBang 승리 나도 받,0
4820,미운 우리 새끼 승리 라멘집 점포당 월 매출 2억 이상민 충격,0
4821,FNC 측 최종훈 FT아일랜드 탈퇴 및 연예계 은퇴 결정조사 협조할 것공식,0
4822,단독 경찰 승리 배임·횡령’ 내사 사업·접대 자금 밝힐까,-1
4823,FNC 측 최종훈·이종현 승리·정준영 사건과 무관법적대응할 것공식입장,0
4824,버닝썬 본사가 박한별 남편 회사,0
4825,EXID 혜린 절친 승리 여동생 클럽에서 디제잉해이한나 인스타그램 눈길,0
4826,로이킴 정준영 단톡방 몰카 논란장수막걸리 불매운동 스타이슈,-1
4827,승리X정준영X최종훈 동업한 밀땅포차 현재 폐업상태,-1
4828,빅뱅 승리 일본라멘집 SNS에서 방사능 육수 논란 안전한가,-1
4829,제주의 야간 볼거리 신화월드 Y夜G Beer Festival,0
4830,포승줄→유치장行 정준영 승리 단톡방 첫 구속 연예인되나 종합,1
4831,승츠비 승리 라멘집 매출 얼마길래 한 매장당 2억원,0
4832,로이킴 금수저 이미지 부양한 장수막걸리카톡방 논란에 불똥,-1
4833,승리·유인석 버닝썬 자금 횡령 추가 입건자금줄 린사모도 출석 요청,-1
4834,SE★PIC FT 아일랜드 이홍기 최종훈 라멘집 방문 맛있뜨아아아,0
4835,빅뱅 승리 라멘 사업 수익금 1억원 기부,1
4836,승리 라멘집 연매출 1000억원 맛집에 깜놀강다니엘·옹성우·설리까지 단골,1
4837,정준영 성관계 몰카 멤버 누구 디스패치 밀땅포차걸그룹 출신 가수 오빠,0
4838,정준영·버닝썬 이사 장씨 나란히 법원 출석오늘 구속 여부 결정종합,0
4839,버닝썬 본사로 의심받는 업체 대표 알고보니 박한별 남편,0
4840,승리·정준영·최종훈 동업한 밀땅포차 현재 폐업SNS도 폐쇄,-1
4841,일본 여행 열풍 속 창업시장도 일본 음식’ 전성시대,1
4842,영장질실심사 마친 버닝썬 사건 관련인,0
4843,제주신화월드 X YG 맥주 축제 Y夜G와야지 비어 페스티벌’ 개최,0
4844,8뉴스 측 정준영 성매매 의심 여성승리 日 투자자 성접대 동원 여성 종,0
4845,정준영과 불법동영상 공유 혐의 김 모 씨 출석,-1
4846,TEN 현장 영장실질심사 앞둔 정준영 모든 혐의 인정준비한 사과문 낭,-1
4847,버닝썬 사태 버닝썬 직원 영장심사,0
4848,설리 월매출 2억 승리 라멘집 방문 인증 먹는 것도 예뻐♥’,0
4849,박한별 남편 승리 파트너 유리홀딩스 대표버닝썬 논란 계속,-1
4850,정준영과 불법동영상 공유 혐의 김 모 씨 출석,-1
4851,TEN 현장 영장실질심사 앞둔 정준영 모든 혐의 인정준비한 사과문 낭,-1
4852,버닝썬 사태 버닝썬 직원 영장심사,0
4853,설리 월매출 2억 승리 라멘집 방문 인증 먹는 것도 예뻐♥’,0
4854,박한별 남편 승리 파트너 유리홀딩스 대표버닝썬 논란 계속,-1
4855,클럽 버닝썬 직원이 약물 권했다는 추가 폭로 나와,0
4856,승리·정준영 카톡방 몰카 사태에 밀땅포차 재조명멤버 누구,0
4857,라면부터 버거까지 사장님은 누구요식업계 빛나는 스타 3인,0
4858,승리 초록우산어린이재단에 1억원 기부 라멘사업 수익금,1
4859,321목 모닝730 이어서조간브리핑,0
